[
  {
    "service_name": "15Five AI",
    "vendor": "15Five",
    "domains": [
      "15five.com"
    ],
    "oauth_app_ids": [],
    "foundation_models": [],
    "category": "hr_analytics",
    "trains_on_user_data": null,
    "data_retention_days": null,
    "has_enterprise_dpa": null,
    "soc2_certified": null,
    "default_risk_tier": "minimal",
    "risk_tier_rationale": "AI-powered performance management and employee feedback analytics platform. Used for internal engagement insights — NOT candidate screening or hiring decisions. No direct interaction with natural persons as an AI system, no autonomous high-stakes employment decisions. No specific EU AI Act obligations apply.",
    "privacy_policy_url": null,
    "tos_url": null
  },
  {
    "service_name": "ABBYY Vantage",
    "vendor": "ABBYY",
    "domains": [
      "abbyy.com"
    ],
    "oauth_app_ids": [],
    "foundation_models": [],
    "category": "document_processing",
    "trains_on_user_data": null,
    "data_retention_days": null,
    "has_enterprise_dpa": null,
    "soc2_certified": null,
    "default_risk_tier": "minimal",
    "risk_tier_rationale": "AI-powered intelligent document processing platform for OCR, classification, and data extraction. Operates as a backend document automation tool with no direct interaction with natural persons as an AI system, no synthetic content generation, and no autonomous high-stakes decisions. No specific EU AI Act obligations apply.",
    "privacy_policy_url": null,
    "tos_url": null
  },
  {
    "service_name": "Abnormal Security",
    "vendor": "Abnormal Security",
    "domains": [
      "abnormalsecurity.com"
    ],
    "oauth_app_ids": [],
    "foundation_models": [],
    "category": "email_security",
    "trains_on_user_data": null,
    "data_retention_days": null,
    "has_enterprise_dpa": null,
    "soc2_certified": null,
    "default_risk_tier": "minimal",
    "risk_tier_rationale": "AI-based email security platform that detects and blocks advanced email threats. Operates as a backend filtering service with no direct interaction with natural persons as an AI system, no synthetic content generation, and no autonomous high-stakes decisions. No specific EU AI Act obligations apply.",
    "privacy_policy_url": null,
    "tos_url": null
  },
  {
    "service_name": "Ada AI",
    "vendor": "Ada Support",
    "domains": [
      "ada.cx",
      "www.ada.cx"
    ],
    "oauth_app_ids": [],
    "foundation_models": [],
    "category": "customer_service_ai",
    "trains_on_user_data": null,
    "data_retention_days": null,
    "has_enterprise_dpa": true,
    "soc2_certified": true,
    "default_risk_tier": "limited",
    "risk_tier_rationale": "AI-powered customer service automation platform. Classified as limited risk under EU AI Act Article 50 — customers interacting with Ada's AI agents must be informed they are engaging with an AI system. The platform automates customer conversations across channels, requiring consistent transparency disclosure across all touchpoints.",
    "privacy_policy_url": null,
    "tos_url": null
  },
  {
    "service_name": "Adobe Firefly",
    "vendor": "Adobe",
    "domains": [
      "firefly.adobe.com",
      "adobe.com"
    ],
    "oauth_app_ids": [
      "adobe-firefly"
    ],
    "foundation_models": [
      "Firefly Image Model 3"
    ],
    "category": "image_generation",
    "trains_on_user_data": false,
    "data_retention_days": 30,
    "has_enterprise_dpa": true,
    "soc2_certified": true,
    "default_risk_tier": "limited",
    "risk_tier_rationale": "AI image and content generation integrated into Adobe Creative Cloud. Limited risk under Article 50 — AI-generated content requires disclosure. Adobe applies Content Credentials (C2PA) metadata to AI-generated images. Trained on licensed and public domain content.",
    "privacy_policy_url": "https://www.adobe.com/privacy/policy.html",
    "tos_url": "https://www.adobe.com/legal/terms.html"
  },
  {
    "service_name": "Aidoc",
    "vendor": "Aidoc Medical Ltd.",
    "domains": [
      "aidoc.com",
      "app.aidoc.com"
    ],
    "oauth_app_ids": [],
    "foundation_models": [],
    "category": "clinical_ai",
    "trains_on_user_data": null,
    "data_retention_days": null,
    "has_enterprise_dpa": null,
    "soc2_certified": null,
    "default_risk_tier": "high",
    "risk_tier_rationale": "High-risk under EU AI Act Annex III, Section 5(a). Aidoc provides FDA-cleared AI radiology solutions that flag acute abnormalities in medical imaging for prioritization. As an AI system intended to be used as a medical device for clinical decision support, it is classified as high-risk.",
    "privacy_policy_url": null,
    "tos_url": null
  },
  {
    "service_name": "Algolia AI",
    "vendor": "Algolia",
    "domains": [
      "algolia.com"
    ],
    "oauth_app_ids": [],
    "foundation_models": [],
    "category": "recommendation_engine",
    "trains_on_user_data": null,
    "data_retention_days": null,
    "has_enterprise_dpa": null,
    "soc2_certified": null,
    "default_risk_tier": "minimal",
    "risk_tier_rationale": "AI-powered recommendation engine for e-commerce and content platforms. Provides backend product and content recommendations without direct interaction with natural persons as an AI system, no synthetic content generation, and no autonomous high-stakes decisions. No specific EU AI Act obligations apply.",
    "privacy_policy_url": null,
    "tos_url": null
  },
  {
    "service_name": "Algolia NeuralSearch",
    "vendor": "Algolia",
    "domains": [
      "neuralsearch.algolia.com"
    ],
    "oauth_app_ids": [],
    "foundation_models": [],
    "category": "search_engine",
    "trains_on_user_data": null,
    "data_retention_days": null,
    "has_enterprise_dpa": null,
    "soc2_certified": null,
    "default_risk_tier": "minimal",
    "risk_tier_rationale": "AI-powered neural search engine for enterprise and e-commerce search indexing. Operates as a backend search infrastructure service with no direct interaction with natural persons as an AI system, no synthetic content generation, and no autonomous high-stakes decisions. No specific EU AI Act obligations apply.",
    "privacy_policy_url": null,
    "tos_url": null
  },
  {
    "service_name": "Amazon CodeWhisperer",
    "vendor": "Amazon Web Services",
    "domains": [
      "aws.amazon.com",
      "codewhisperer.aws"
    ],
    "oauth_app_ids": [],
    "foundation_models": [
      "Amazon CodeWhisperer proprietary"
    ],
    "category": "code_assistant",
    "trains_on_user_data": false,
    "data_retention_days": null,
    "has_enterprise_dpa": true,
    "soc2_certified": true,
    "default_risk_tier": "limited",
    "risk_tier_rationale": "AI-powered code generation and suggestion tool integrated into AWS developer tools. Classified as limited risk under EU AI Act Article 50 — AI-generated code must be transparently identified to developers. Professional tier does not use customer code for model training. Risk may increase if used in safety-critical software development.",
    "privacy_policy_url": null,
    "tos_url": null
  },
  {
    "service_name": "Anyword",
    "vendor": "Anyword",
    "domains": [
      "anyword.com",
      "app.anyword.com"
    ],
    "oauth_app_ids": [],
    "foundation_models": [],
    "category": "content_generation",
    "trains_on_user_data": null,
    "data_retention_days": null,
    "has_enterprise_dpa": null,
    "soc2_certified": null,
    "default_risk_tier": "limited",
    "risk_tier_rationale": "AI copywriting and performance prediction platform for marketing teams. Classified as limited risk under EU AI Act Article 50 — AI generates marketing copy and predicts performance, requiring transparency that content is AI-produced. AI-generated ad copy and landing page text must be disclosed.",
    "privacy_policy_url": null,
    "tos_url": null
  },
  {
    "service_name": "Applitools",
    "vendor": "Applitools",
    "domains": [
      "applitools.com"
    ],
    "oauth_app_ids": [],
    "foundation_models": [],
    "category": "testing_qa",
    "trains_on_user_data": null,
    "data_retention_days": null,
    "has_enterprise_dpa": null,
    "soc2_certified": null,
    "default_risk_tier": "minimal",
    "risk_tier_rationale": "AI-powered visual testing and monitoring platform for UI validation. Operates as a backend QA infrastructure tool with no direct interaction with natural persons as an AI system, no synthetic content generation, and no autonomous high-stakes decisions. No specific EU AI Act obligations apply.",
    "privacy_policy_url": null,
    "tos_url": null
  },
  {
    "service_name": "Asana AI",
    "vendor": "Asana",
    "domains": [
      "asana.com"
    ],
    "oauth_app_ids": [],
    "foundation_models": [],
    "category": "productivity_assistant",
    "trains_on_user_data": null,
    "data_retention_days": null,
    "has_enterprise_dpa": null,
    "soc2_certified": null,
    "default_risk_tier": "minimal",
    "risk_tier_rationale": "AI-powered task and project management features within Asana. Internal productivity tool with no direct interaction with natural persons as an AI system, no synthetic content generation, and no autonomous high-stakes decisions. No specific EU AI Act obligations apply.",
    "privacy_policy_url": null,
    "tos_url": null
  },
  {
    "service_name": "Avoma",
    "vendor": "Avoma",
    "domains": [
      "avoma.com",
      "app.avoma.com"
    ],
    "oauth_app_ids": [],
    "foundation_models": [],
    "category": "meeting_transcription",
    "trains_on_user_data": null,
    "data_retention_days": null,
    "has_enterprise_dpa": null,
    "soc2_certified": true,
    "default_risk_tier": "limited",